{
  "schemaVersion": "2.0.0",
  "note": "唯一机器可读范围权威。此前存放于交接书 §18.2.1 的 markdown JSON fence，现外置。scopeItems[].targetRelease 使本文件跨 V0.5/V0.6 通用：deferred 条目带 deferredToRelease 与 resumeRequires，V0.6 恢复时改这里，不新建文档。冻结保护见 releases.json。",
  "proposalId": "V0.5-SCOPE-20260725",
  "release": "V0.5",
  "game": "Sekiro",
  "gameBuildRange": {
    "status": "user-approved",
    "matchPolicy": "file-product-version-major-minor",
    "versionFamilies": [
      "1.6"
    ],
    "exactBuilds": [],
    "unknownBuildPolicy": "fail-closed"
  },
  "ruling": {
    "status": "user-approved",
    "approvedBy": "repository-owner",
    "approvedAt": "2026-07-30T09:37:03.836Z",
    "decisionRef": "codex-thread:019fa924-bb20-7d23-aab9-3863957c5e10"
  },
  "proposalStatus": "user-approved",
  "unlistedPolicy": "unsupported",
  "corpusPolicy": {
    "privateFixtureRegistryIsReleaseCorpus": false,
    "supportedWithoutReleaseCorpus": "requires-open-ruling"
  },
  "scopeDeferralPolicy": {
    "status": "user-approved",
    "deferredToRelease": "V0.6",
    "deferredIsNotCompleted": true,
    "deferredIsNotPermanentlyExcluded": true,
    "deferredCodeMayRemainAsMarkedPreview": true,
    "deferredPreviewMustBeReadOnly": true
  },
  "authoritySnapshotPolicy": {
    "field": "authorityAtRuling",
    "asOfEvidenceRef": "EV-REL-SCOPE-20260730",
    "liveAuthoritySource": "docs/governance/slices.json",
    "nonClaimsAreRulingTimeSnapshot": true
  },
  "paramMetadataSourcePolicy": {
    "status": "user-approved",
    "sourceProject": "SoulForge",
    "sourceRelease": "sekiro-1.6.x",
    "sourceCommit": "first-party-schema-package-v1.0.0",
    "sourceArtifactSha256": "e42fde9b453fad62490e0f6ee2bb9c34d37293313caf52b5df0f2747163d3daf",
    "sourcePath": "packages/core/src/schema/sekiro/firstPartySchemaData.ts",
    "acquisition": "first-party-reviewed-semantic-projection",
    "redistribution": "permitted",
    "mismatchPolicy": "fail-closed",
    "packageId": "soulforge-sekiro-param",
    "packageVersion": "1.0.0",
    "contentDigest": "sha256:e42fde9b453fad62490e0f6ee2bb9c34d37293313caf52b5df0f2747163d3daf",
    "thirdPartyRuntimeDependency": "forbidden",
    "nativeFormatAuthority": false
  },
  "providerCredentialPolicy": {
    "status": "user-approved",
    "defaultConfiguration": "empty",
    "realProviderCredentialsRequiredForV05Acceptance": false,
    "unconfiguredBehavior": "diagnose-without-network-call"
  },
  "runtimeToolPolicy": {
    "status": "user-approved",
    "adapter": "me3",
    "sourceProject": "garyttierney/me3",
    "sourceRelease": "v0.12.1",
    "sourceArtifactSha256": "b1c11659b0cfde73062b2fa134a8ac499f3e713fe82d9014401289677ace7323",
    "provisioningResponsibility": "project-engineering",
    "compatibilityPolicy": "capability-probe-fail-closed",
    "revisionNote": "2026-08-18 用户裁定（releases.json unfreezeRuling 第三次追加）：撤销「不自实现 Mod loader 取代 me3」禁令，允许自行实现 Mod loader（须经独立切片、requiredValidation、Patch Engine 与审计边界，不得写入原版游戏目录）；me3 仍为当前已集成路线，GameRuntimeAdapter 保持可替换接口。"
  },
  "renderingAcceptancePolicy": {
    "status": "user-approved",
    "functionalOwnerMachineSmokeRequired": true,
    "representativeHardwareTiersRequired": false,
    "performanceBudgetsRequired": false
  },
  "quantitativeAcceptancePolicy": {
    "status": "user-approved",
    "editorCapacityOrLatencyThresholdsRequired": false,
    "installerSizeOrTimeBudgetsRequired": false,
    "boundedEditorAccessRequired": true,
    "installerLifecycleIntegrityRequired": true
  },
  "scopeItems": [
    {
      "scopeItemId": "SCOPE-SEKIRO-BUILD",
      "capabilityId": "H-RUNTIME",
      "gateIds": [
        "REL-SCOPE",
        "REL-H"
      ],
      "subjectKind": "game-build",
      "scope": "Sekiro 1.6.x 文件/产品版本族与 build identity",
      "decisionStatus": "user-approved",
      "proposedSupport": "supported",
      "operations": [
        "detect-file-product-version",
        "match-major-minor-1.6",
        "record-exact-build-identity",
        "fail-closed-on-non-1.6-build"
      ],
      "unsupportedOperations": [
        "support-unlisted-game",
        "assume-non-1.6-build-compatible",
        "treat-version-family-as-native-evidence"
      ],
      "authorityAtRuling": "unverified",
      "evidenceRefs": [
        "EV-PRIVATE-20260724"
      ],
      "registryRefs": [],
      "openRulings": [],
      "nonClaims": [
        "用户批准 1.6.x 版本族只冻结目标兼容范围；裁定时 authorityAtRuling 为 unverified，每个实际 build 仍须进入 release corpus 并通过真实验证。"
      ],
      "targetRelease": "V0.5",
      "deferredToRelease": null,
      "deferredTrack": null,
      "resumeRequires": []
    },
    {
      "scopeItemId": "SCOPE-A-WORKSPACE",
      "capabilityId": "A-WORKSPACE",
      "gateIds": [
        "REL-A"
      ],
      "subjectKind": "workspace",
      "scope": "单一可写 Mod 叠加层、可选只读原版层与应用数据外置",
      "decisionStatus": "user-approved",
      "proposedSupport": "supported",
      "operations": [
        "open-single-mod-overlay",
        "attach-optional-readonly-game-base",
        "index-readonly-game",
        "stage-mod-resource-via-patch-engine",
        "store-metadata-in-app-data"
      ],
      "unsupportedOperations": [
        "write-original-game",
        "write-mod-resource-outside-patch-engine",
        "store-sidecar-in-mod-workspace",
        "open-multiple-writable-overlays"
      ],
      "authorityAtRuling": "partial",
      "evidenceRefs": [
        "EV-A-SAFETY-20260720"
      ],
      "registryRefs": [],
      "openRulings": [],
      "nonClaims": [
        "范围批准不证明全部 production writer 已接入单一写入主干，也不证明真实外部路径与重解析边界已完成。"
      ],
      "targetRelease": "V0.5",
      "deferredToRelease": null,
      "deferredTrack": null,
      "resumeRequires": []
    },
    {
      "scopeItemId": "SCOPE-A-RECOVERY",
      "capabilityId": "A-RECOVERY",
      "gateIds": [
        "REL-A"
      ],
      "subjectKind": "recovery",
      "scope": "operation、file、resource-entry 三层审计、回滚与崩溃恢复",
      "decisionStatus": "user-approved",
      "proposedSupport": "supported",
      "operations": [
        "stage",
        "validate",
        "commit-with-backup",
        "re-read",
        "audit",
        "rollback",
        "recover-after-commit",
        "gate-every-release-writer"
      ],
      "unsupportedOperations": [
        "publish-writer-without-failure-matrix",
        "overwrite-revision-conflict",
        "swallow-recovery-failure",
        "bypass-backup"
      ],
      "authorityAtRuling": "partial",
      "evidenceRefs": [
        "EV-A-RECOVERY-20260724",
        "EV-PUBLIC-CONTRACTS-20260725"
      ],
      "registryRefs": [],
      "openRulings": [],
      "nonClaims": [
        "所有发布 writer 均被纳入恢复门禁；现有 harness 不证明尚未实现或缺少 corpus 的 writer 已通过真实崩溃、断电与资源项恢复矩阵。"
      ],
      "targetRelease": "V0.5",
      "deferredToRelease": null,
      "deferredTrack": null,
      "resumeRequires": []
    },
    {
      "scopeItemId": "SCOPE-DFLT",
      "capabilityId": "B-DFLT",
      "gateIds": [
        "REL-B"
      ],
      "subjectKind": "container",
      "scope": "注册 Sekiro DFLT 布局的解压、无修改往返、重压与重读",
      "decisionStatus": "user-approved",
      "proposedSupport": "supported",
      "operations": [
        "classify",
        "decompress",
        "no-op-roundtrip",
        "recompress",
        "re-read"
      ],
      "unsupportedOperations": [
        "accept-unregistered-layout",
        "rewrite-unknown-fields"
      ],
      "authorityAtRuling": "native-verified",
      "evidenceRefs": [
        "EV-B-DFLT-7BD"
      ],
      "registryRefs": [
        {
          "registryRef": "historical-corpus:EV-B-DFLT-7BD",
          "kind": "historical-private-corpus",
          "releaseCorpus": false
        }
      ],
      "openRulings": [],
      "nonClaims": [
        "登记 DFLT 布局的完整读写是目标范围；历史 144 个样本与两个变体仍不构成当前 1.6.x release corpus 或未知布局 authority。"
      ],
      "targetRelease": "V0.5",
      "deferredToRelease": null,
      "deferredTrack": null,
      "resumeRequires": []
    },
    {
      "scopeItemId": "SCOPE-KRAK",
      "capabilityId": "B-KRAK",
      "gateIds": [
        "REL-B"
      ],
      "subjectKind": "container",
      "scope": "登记 Sekiro KRAK 布局与用户合法 Oodle runtime 的解压、重压、写回、重读与恢复闭环",
      "decisionStatus": "user-approved",
      "proposedSupport": "supported",
      "operations": [
        "validate-user-oodle-runtime",
        "classify",
        "decompress",
        "recompress",
        "write",
        "re-read",
        "rollback"
      ],
      "unsupportedOperations": [
        "distribute-oodle",
        "accept-unregistered-layout",
        "bypass-oodle-license-or-runtime-validation"
      ],
      "authorityAtRuling": "partial",
      "evidenceRefs": [
        "EV-B-KRAK-20260724"
      ],
      "registryRefs": [
        {
          "registryRef": "fixture:krak-preview",
          "kind": "private-fixture",
          "releaseCorpus": false
        }
      ],
      "openRulings": [],
      "nonClaims": [
        "完整 KRAK 读写已纳入目标范围，但裁定时 authorityAtRuling 为 partial；单个私有解压 preview 不证明压缩、写回、恢复或 release corpus 已完成。"
      ],
      "targetRelease": "V0.5",
      "deferredToRelease": null,
      "deferredTrack": null,
      "resumeRequires": []
    },
    {
      "scopeItemId": "SCOPE-BND4",
      "capabilityId": "B-BND4",
      "gateIds": [
        "REL-B"
      ],
      "subjectKind": "container",
      "scope": "注册 Sekiro BND4 布局的 browse、entry mutation、repack、重读与回滚",
      "decisionStatus": "user-approved",
      "proposedSupport": "supported",
      "operations": [
        "classify",
        "browse",
        "add-entry",
        "replace-entry",
        "delete-entry",
        "rename-entry",
        "move-entry",
        "repack",
        "validate-dflt-krak-inner-chain",
        "re-read",
        "rollback"
      ],
      "unsupportedOperations": [
        "accept-unregistered-flags",
        "rewrite-unknown-layout",
        "claim-unregistered-inner-coverage"
      ],
      "authorityAtRuling": "native-verified",
      "evidenceRefs": [
        "EV-B-BND4-7BD",